Software Carpentry: Git Novice lesson,General,,"Maintainability, Sustainability","individual training resource (course, handbook, article, guide, tutorial)",,Software Carpentry: Git Novice lesson,https://swcarpentry.github.io/git-novice,https://swcarpentry.github.io/git-novice,"Version control is the lab notebook of the digital world: it’s what professionals use to keep track of what they’ve done and to collaborate with other people. Every large software development project relies on it, and most programmers use it for their small jobs as well. And it isn’t just for software: books, papers, small data sets, and anything that changes over time or needs to be shared can and should be stored in a version control system.","version, control, git, github, licensing",course,research software development,,Published,,,,,research software engineers,,,,,,,,
CodeRefinery: Collaborative distributed version control,General,,"Maintainability, Sustainability","individual training resource (course, handbook, article, guide, tutorial)",,CodeRefinery: Collaborative distributed version control,https://coderefinery.github.io/git-collaborative/,https://coderefinery.github.io/git-collaborative/,We have learned how to work with a Git repository used by a single person. What about sharing and collaborating?,"version, control, git, github",course,research software development,,Published,,,,,research software engineers,,,,,,,,
CodeRefinery: Introduction to version control,General,,"Maintainability, Sustainability","individual training resource (course, handbook, article, guide, tutorial)",,CodeRefinery: Introduction to version control,https://coderefinery.github.io/git-intro/,https://coderefinery.github.io/git-intro/,Introduction to version control with Git - Why we want to track versions and how to go back in time to a working version,"version, control, git, github",course,research software development,,Published,,,,,research software engineers,,,,,,,,
Continuous Integration / Continuous Development (CI/CD),General,,"Maintainability, Security, Sustainability, Reliability, Functional suitability","individual training resource (course, handbook, article, guide, tutorial)",,Continuous Integration / Continuous Development (CI/CD),https://hsf-training.github.io/hsf-training-cicd/,https://hsf-training.github.io/hsf-training-cicd/,"GitLab is a git platform used for code hosting and collaboration. It can be used to automatically run checks and other code or workflows on GitLab’s servers. We’ll learn how to use this to make our code robust to errors, preserved, and reproducible.","gitlab, collaboration, workflow, reproducibility, CI/CD",course,research software development,,Published,,,,,research software engineers,,,,,,,,
Python Testing and Continuous Integration,General,,"Maintainability, Security, Sustainability, Reliability, Functional suitability","individual training resource (course, handbook, article, guide, tutorial)",,Python Testing and Continuous Integration,https://carpentries-incubator.github.io/python-testing/,https://carpentries-incubator.github.io/python-testing/,"In this lesson we use a Python library called pytest. Basic understanding of Python variables and functions are a necessary prerequisite. Some previous experience with the shell is expected, but isn’t mandatory.","python, pytest, testing, automation, continuous integration, CI/CD",course,research software development,,Published,,,,,research software engineers,,,,,,,,
Workflows with Python and Git,General,,"Maintainability, Security, Sustainability, Reliability, Functional suitability","individual training resource (course, handbook, article, guide, tutorial)",,Workflows with Python and Git,https://carpentries-incubator.github.io/swc-ext-python/,https://carpentries-incubator.github.io/swc-ext-python/,"In this lesson, we will apply use of functions, conditionals and loops to solve a problem.","programming language, python, version control",course,research software development,,Published,,,,,research software engineers,,,,,,,,
Introduction to Cloud Computing for Genomics,Life sciences,,Functional suitability,"individual training resource (course, handbook, article, guide, tutorial)",,Introduction to Cloud Computing for Genomics,https://datacarpentry.org/cloud-genomics/index.html,https://datacarpentry.org/cloud-genomics/index.html,"In this lesson, you’ll learn about renting cloud services that fit your analytic needs, and how to interact with one of those services (AWS) via the command line.
","cloud, genomics, aws, cli, data",course,research software development,,Published,,,,,research software engineers,,,,,,,,
"Software Carpentry: Introduction
to Workflows with Common Workflow Language",General,,"Functional suitability, Reliability","individual training resource (course, handbook, article, guide, tutorial)",,"Software Carpentry: Introduction
to Workflows with Common Workflow Language",https://carpentries-incubator.github.io/cwl-novice-tutorial/,https://carpentries-incubator.github.io/cwl-novice-tutorial/,"This tutorial guides you through the the fundamentals of designing and building an analysis workflow. It assumes no previous knowledge or experience of workflows or Common Workflow Language (CWL), but does assume some experience with the Unix command line.","workflows, common workflow language, cwl, unix, cli",course,research software development,,Published,,,,,research software engineers,,,,,,,,
Software Carpentry: Programming with Python,General,,"Functional suitability, Reliability","individual training resource (course, handbook, article, guide, tutorial)",,Software Carpentry: Programming with Python,https://swcarpentry.github.io/python-novice-inflammation/index.html,https://swcarpentry.github.io/python-novice-inflammation/index.html,"The best way to learn how to program is to do something useful, so this introduction to Python is built around a common scientific task: data analysis.","programming language, python",course,research software development,,Published,,,,,research software engineers,,,,,,,,
"Software Carpentry: Plotting and
Programming in Python",General,,"Functional suitability, Reliability","individual training resource (course, handbook, article, guide, tutorial)",,"Software Carpentry: Plotting and
Programming in Python",https://swcarpentry.github.io/python-novice-gapminder/index.html,https://swcarpentry.github.io/python-novice-gapminder/index.html,"The lesson will teach you how to Launch the JupyterLab server; create a new Python script; create a Jupyter notebook, shutdown the JupyterLab server; understand the difference between a Python script and a Jupyter notebook; create Markdown cells in a notebook; create and run Python cells in a notebook.","programming language, python, jupyterlab, python script",course,research software development,,Published,,,,,research software engineers,,,,,,,,
Level Up your Python,General,,"Functional suitability, Reliability","individual training resource (course, handbook, article, guide, tutorial)",,Level Up your Python,https://henryiii.github.io/level-up-your-python/notebooks/0%20Intro.html,https://henryiii.github.io/level-up-your-python/notebooks/0%20Intro.html,A course in intermediate Python for a beginner ready to move up. Binder version and Live WebAssembly version available too!,"programming language, python",course,research software development,,Published,,,,,research software engineers,,,,,,,,
Library Carpentry: Python Intro for Libraries,General,,"Functional suitability, Reliability","individual training resource (course, handbook, article, guide, tutorial)",,Library Carpentry: Python Intro for Libraries,https://librarycarpentry.org/lc-python-intro/,https://librarycarpentry.org/lc-python-intro/,"This lesson is an introduction to programming in Python for library and information workers with little or no previous programming experience. It uses examples that are relevant to a range of library use cases, and is designed as a prerequisite for other Python lessons that will be developed in the future (e.g., web scraping, APIs). The lesson uses the JupyterLab computing environment and Python 3.","programming language, python",course,research software development,,Published,,,,,research software engineers,,,,,,,,
Building Better Scientific Software in Python,General,,"Functional suitability, Reliability","individual training resource (course, handbook, article, guide, tutorial)",,Building Better Scientific Software in Python,https://python-tutorial.dev/201/,https://python-tutorial.dev/201/,"The goal of this tutorial is to expose researchers to several best practices in scientific software engineering that may otherwise take several years to become acquainted with. Though the implementation of these lessons is Python-specific, the essential ideas can be exported to other languages or platforms.","programming language, python, packaging, testing, documentation, logging, performance",course,research software development,,Published,,,,,research software engineers,,,,,,,,
"Software Carpentry: R for
Reproducible Scientific Analysis",General,,"Functional suitability, Reliability","individual training resource (course, handbook, article, guide, tutorial)",,"Software Carpentry: R for
Reproducible Scientific Analysis",https://swcarpentry.github.io/r-novice-gapminder/,https://swcarpentry.github.io/r-novice-gapminder/,The goal of this lesson is to teach novice programmers to write modular code and best practices for using R for data analysis,"programming language, R, reproducibility",course,research software development,,Published,,,,,research software engineers,,,,,,,,
Software Carpentry: Programming with R,General,,"Functional suitability, Reliability","individual training resource (course, handbook, article, guide, tutorial)",,Software Carpentry: Programming with R,https://swcarpentry.github.io/r-novice-inflammation/,https://swcarpentry.github.io/r-novice-inflammation/,"The best way to learn how to program is to do something useful, so this introduction to R is built around a common scientific task: data analysis. Our real goal isn’t to teach you R, but to teach you the basic concepts that all programming depends on","programming language, R",course,research software development,,Published,,,,,research software engineers,,,,,,,,
"Getting Used to R, RStudio, and R Markdown",General,,"Functional suitability, Reliability","individual training resource (course, handbook, article, guide, tutorial)",,"Getting Used to R, RStudio, and R Markdown",https://rbasics.netlify.app/,https://rbasics.netlify.app/,"This material  was written to give people who are new to R, RStudio, and R Markdown the tools they need to begin making their own research reproducible","programming language, R",course,research software development,,Published,,,,,research software engineers,,,,,,,,
Modern Dive into R and the Tidyverse,General,,"Functional suitability, Reliability","individual training resource (course, handbook, article, guide, tutorial)",,Modern Dive into R and the Tidyverse,https://moderndive.netlify.app/,https://moderndive.netlify.app/,This online handbook aims at providing statistical inference via data science using R and Tidyverse,"programming language, R",course,research software development,,Published,,,,,research software engineers,,,,,,,,
"Software Carpentry: Programming
with MATLAB",General,,"Functional suitability, Reliability","individual training resource (course, handbook, article, guide, tutorial)",,"Software Carpentry: Programming
with MATLAB",https://swcarpentry.github.io/matlab-novice-inflammation/,https://swcarpentry.github.io/matlab-novice-inflammation/,"The best way to learn how to program is to do something useful, so this introduction to MATLAB is built around a common scientific task: data analysis. Our real goal isn’t to teach you MATLAB, but to teach you the basic concepts that all programming depends on. ","programming language, MATLAB",course,research software development,,Published,,,,,research software engineers,,,,,,,,
Introduction to the Internet of Things,General,,,"individual training resource (course, handbook, article, guide, tutorial)",,Introduction to the Internet of Things,https://carpentries-incubator.github.io/IoT_arduino_nano/,https://carpentries-incubator.github.io/IoT_arduino_nano/,"In this lesson, your will learn: About IoT ; Arduino Nano architecture and Arduino GUI; Learn to blink the internal led of an Arduino Nano; Learn to create a simple weather station with an Arduino Nano
","internet of things, arduino, arduino nano",course,research software development,,Published,,,,,research software engineers,,,,,,,,
Automated Testing - Preventing Yourself and others from Breaking your Functioning Code,General,,"Functional suitability, Maintainability","individual training resource (course, handbook, article, guide, tutorial)",,Automated Testing - Preventing Yourself and others from Breaking your Functioning Code,https://coderefinery.github.io/testing/,https://coderefinery.github.io/testing/,"This lesson will talk about the places it’s useful for research code, and how easy it can be. We will discuss why testing often needs to be part of the software development cycle and how such a cycle can be implemented. We will see how automated testing works and practice designing and writing tests.","testing, continuous integration, automation, python",course,research software development,,Published,,,,,research software engineers,,,,,,,,
How to Document your Research Software,General,,Sustainability,"individual training resource (course, handbook, article, guide, tutorial)",,How to Document your Research Software,https://coderefinery.github.io/documentation/,https://coderefinery.github.io/documentation/,This lesson discusses different solutions for implementing and deploying code documentation.,"documentation, readme, readthedocs, github pages",course,research software development,,Published,,,,,research software engineers,,,,,,,,
CodeRefinery: Software Citation,General,,FAIRness,"individual training resource (course, handbook, article, guide, tutorial)",,CodeRefinery: Software Citation,https://coderefinery.github.io/social-coding/software-citation/,https://coderefinery.github.io/social-coding/software-citation/,This resource will help you untangle these questions: Is putting software on GitHub/GitLab/… publishing? Where to publish software? How can software be cited? How can I make my software citeable?,"citation, publishing, releasing, fair",course,research software development,,Published,,,,,research software engineers,,,,,,,,
CodeRefinery: Software Licensing,General,,FAIRness,"individual training resource (course, handbook, article, guide, tutorial)",,CodeRefinery: Software Licensing,https://coderefinery.github.io/social-coding/software-licensing/,https://coderefinery.github.io/social-coding/software-licensing/,A course on software licensing,license,course,research software development,,Published,,,,,research software engineers,,,,,,,,
SQL for Humanities,Social sciences and humanities,,Functional suitability,"individual training resource (course, handbook, article, guide, tutorial)",,SQL for Humanities,https://carpentries-incubator.github.io/sql-humanities-lesson/,https://carpentries-incubator.github.io/sql-humanities-lesson/,"This lesson will teach you what relational databases are, how you can load data into them and how you can query databases to extract just the information that you need.","database, SQL, data",course,research software development,,Published,,,,,research software engineers,,,,,,,,
SQL for Business,Social sciences and humanities,,Functional suitability,"individual training resource (course, handbook, article, guide, tutorial)",,SQL for Business,https://carpentries-incubator.github.io/sql-business/,https://carpentries-incubator.github.io/sql-business/,"This lesson will teach you what relational databases are, how you can load data into them and how you can query databases to extract just the information that you need.","sql, business, database, quality control",course,research software development,,Published,,,,,research software engineers,,,,,,,,
"Software Carpentry: Database and
SQL",General,,Functional suitability,"individual training resource (course, handbook, article, guide, tutorial)",,"Software Carpentry: Database and
SQL",https://swcarpentry.github.io/sql-novice-survey/,https://swcarpentry.github.io/sql-novice-survey/,These lessons will show how to use a database to explore the expeditions’ data.,"database, sql, data, python, R",course,research software development,,Published,,,,,research software engineers,,,,,,,,
"CodeRefinery: Jupyter Notebooks - A tool to write
and share executable notebooks and data visualization",General,,Functional suitability,"individual training resource (course, handbook, article, guide, tutorial)",,"CodeRefinery: Jupyter Notebooks - A tool to write
and share executable notebooks and data visualization",https://coderefinery.github.io/jupyter/,https://coderefinery.github.io/jupyter/,"The goal of this lesson is to teach learners the user interface of JupyterLab, how Jupyter notebooks work, and what some common and powerful use cases are.","jupyter notebook, notebooks, data visualization, jupyterlab",course,research software development,,Published,,,,,research software engineers,,,,,,,,
Python Packaging,General,,FAIRness,"individual training resource (course, handbook, article, guide, tutorial)",,Python Packaging,https://carpentries-incubator.github.io/python_packaging/,https://carpentries-incubator.github.io/python_packaging/,This lesson teaches how to create and publish packages in Python,"package, packaging, release, python",course,research software development,,Published,,,,,research software engineers,,,,,,,,
Managing Academic Software Development,General,,FAIRness,"individual training resource (course, handbook, article, guide, tutorial)",,Managing Academic Software Development,https://southampton-rsg.github.io/swc-project-novice/,https://southampton-rsg.github.io/swc-project-novice/,"This workshop teaches the basics of managing project development and release, using the project management tools on the repository hosting site GitHub (and is applicable to repositories hosted on GitLab).","release, git, github, gitlab, identifiers, version",course,research software development,,Published,,,,,research software engineers,,,,,,,,
"Software Carpentry: Managing
Research Software Projects",General,,FAIRness,"individual training resource (course, handbook, article, guide, tutorial)",,"Software Carpentry: Managing
Research Software Projects",https://swcarpentry.github.io/managing-research-software-projects/,https://swcarpentry.github.io/managing-research-software-projects/,"Introduction to the basics of software project management with a particular focus on the sorts of projects commonly found in research settings. Participants should have previously worked on programs containing thousands or tens of thousands of lines of code, and be regular users of basic tools like the Unix shell and a version control system. Building on that foundation, this course will discuss:","license, version control, continous integration, robust, code review, testing",course,research software development,,Published,,,,,research software engineers,,,,,,,,
"Reproducible
Computational Environments using Containers: Introduction to Singularity","General, Particle physics & astronomy",,"FAIRness, Flexibility, Maintainability, Reliability, Security, Sustainability","curriculum (set of several training courses, a learning pathway) ",,"Reproducible
Computational Environments using Containers: Introduction to Singularity",https://carpentries-incubator.github.io/singularity-introduction/,https://carpentries-incubator.github.io/singularity-introduction/,"This lesson provides an introduction to using the Singularity container platform. Singularity is particularly suited to running containers on infrastructure where users don’t have administrative privileges, for example shared infrastructure such as High Performance Computing (HPC) clusters.","container, reproducible environment, reproducibility, singularity, HPC",course,research software development,,Published,,,,,research software engineers,,,,,,,,
"Reproducible
Computational Environments Using Containers: Introduction to Docker","General, Particle physics & astronomy",,"FAIRness, Flexibility, Sustainability, Security, Reliability, Maintainability","individual training resource (course, handbook, article, guide, tutorial)",,"Reproducible
Computational Environments Using Containers: Introduction to Docker",https://carpentries-incubator.github.io/docker-introduction/,https://carpentries-incubator.github.io/docker-introduction/,"This material aims to introduce the use of Docker containers with the goal of using them to effect reproducible computational environments. Such environments are useful for ensuring reproducible research outputs, for example.","docker, container, reproducible environment, reproducibility, singularity",course,research software development,,Published,,,,,research software engineers,,,,,,,,
"Introduction
to Docker and Podman","General, Particle physics & astronomy",,"Sustainability, Security, Reliability, Maintainability, FAIRness, Flexibility","individual training resource (course, handbook, article, guide, tutorial)",,"Introduction
to Docker and Podman",https://hsf-training.github.io/hsf-training-docker/index.html,https://hsf-training.github.io/hsf-training-docker/index.html,An introduction to using Docker and Podman as software development tools.,This material is an introduction to machin learning with Python. Topics are: Unsupervised Learning: dimensionality reductiong; unsupervised Learning: clustering; supervised Learning: basic methods; supervised Learning: using real data and preprocessing,course,research software development,,Published,,,,,research software engineers,,,,,,,,
Welcome to Python Packages,General,,"Functional suitability, Interaction capability, Maintainability, Reliability, Sustainability","individual training resource (course, handbook, article, guide, tutorial)",,Welcome to Python Packages,https://py-pkgs.org/welcome,https://py-pkgs.org/welcome,"Python packages are a core element of the Python programming language and are how you create organized, reusable, and shareable code in Python. Python Packages is an open source book that describes modern and efficient workflows for creating Python packages.","programming language, python, packaging, package, release",course,research software development,,Published,,,,,research software engineers,,,,,,,,
Tools and Practices for FAIR Research Software,General,,"Sustainability, FAIRness, Maintainability","individual training resource (course, handbook, article, guide, tutorial)",,Tools and Practices for FAIR Research Software,https://carpentries-incubator.github.io/fair-research-software/,https://carpentries-incubator.github.io/fair-research-software/,"This short course is teaching tools and practices for producing and sharing quality, sustainable and FAIR (Findable, Accessible, Interoperable and Reusable) research software to support open and reproducible research.","FAIR, documentation, reproducible environment, readable code, documentation",course,research software development,,Published,,,,,research software engineers,,,,,,,,
Modern Scientific C++,"Particle physics & astronomy, General",,"Functional suitability, Performance efficiency, Reliability, Flexibility","individual training resource (course, handbook, article, guide, tutorial)",,Modern Scientific C++,https://github.com/chavid/ModernScientificCpp,https://github.com/chavid/ModernScientificCpp,"This training material addresses modern scientific computing in C++, for people who already have some experience in legacy C++ programming (before C++ 11)","programming language, c++",course,research software development,,Published,,,,,research software engineers,,,,,,,,
Cpp17 Initiation for Pythonists,"Particle physics & astronomy, General",,"Functional suitability, Performance efficiency, Reliability, Flexibility, Compatibility","individual training resource (course, handbook, article, guide, tutorial)",,Cpp17 Initiation for Pythonists,https://gitlab.in2p3.fr/informatique-des-deux-infinis/pheniics/cpp17-initiation-for-pythonists,https://gitlab.in2p3.fr/informatique-des-deux-infinis/pheniics/cpp17-initiation-for-pythonists,"This training material addresses modern scientific computing in C++, for people who already have some experience in legacy C++ programming (before C++ 11):","programming language, c++, scientific computin",course,research software development,,Published,,,,,research software engineers,,,,,,,,
Python Traps and Pitfalls,"Particle physics & astronomy, General",,Functional suitability,"individual training resource (course, handbook, article, guide, tutorial)",,Python Traps and Pitfalls,https://gitlab.in2p3.fr/informatique-des-deux-infinis/pheniics/python-traps,https://gitlab.in2p3.fr/informatique-des-deux-infinis/pheniics/python-traps,"A closer look at the basic mechanisms of the Python language, beyond what can be guessed by blindly copying and pasting examples, in order to avoid the most common traps and pitfalls","programming language, python",course,research software development,,Published,,,,,research software engineers,,,,,,,,
